[
  {"id":"edge.executor-memory","from":"agent.executor","to":"memory.long-term","relation":"writes","attributes":{},"evidence_refs":["evidence.fixture.executor-memory"]},
  {"id":"edge.primary-state","from":"service.primary","to":"store.state","relation":"writes","attributes":{},"evidence_refs":["evidence.fixture.primary"]},
  {"id":"edge.secondary-state","from":"service.secondary","to":"store.state","relation":"writes","attributes":{},"evidence_refs":["evidence.fixture.secondary"]}
]
